<?xml version="1.0" encoding="UTF-8"?>
<dl2 xmlns="http://www.example.org/EshuConfig" xmlns:xsi="http://www.w3.org/2001/XMLSchema-instance" xsi:schemaLocation="http://www.example.org/EshuConfig DL2.xsd ">
  <style>
    <editorStyle width="900" height="500" borderWidth="1" 
          borderColor="#000" background="white"  
          gridVisible="false" gridColorLine="#c0c0c0"/>
    
    <toolbarStyle width="500" height="300" borderWidth="1"
       				borderColor="black" background="WhiteSmoke"
       				position="vertical"  />
     <windowsProperties disabled="false" startVisible="false"/>  				
  </style>
  <diagram extension="" name="">
    
   
    
    
    
    <nodeTypes>
      <type>Action</type>
      <variant>Action</variant>
      <label alignment="center" defaultValue="Action" disabled="false" firstLetterCase="lowercase" letterCase="lowercase" pattern="(\w+)" position="center" marginHeight="0" marginWidth="0" underlined="0"  textColor="black" textFont="11px Arial" >
        <field name="name" value="1"/>
      </label>
      <isConfigurable>true</isConfigurable>
      <includeElement>false</includeElement>
       <rotation>false</rotation>
      <infoUrlNode>
        <url>https://www.tutorialspoint.com/uml/uml_basic_notations.htm</url>
      </infoUrlNode>
       <handlers> 
         <handler  position="northwest"/> 
         <handler  position="northeast"/>
         <handler  position="southeast"/>
         <handler  position="southwest"/> 
      </handlers>
      <anchors> 
         <anchor  position="north"/>
         <anchor  position="south"/> 
          <anchor  position="east"/>
          <anchor  position="west"/> 
      </anchors>
      <propertiesNode>
         <property name="type" type="String" typeShow="input" disabled="true" impExp="true" view="true"  />
	      <property name="id" type="Number" typeShow="input" disabled="true" impExp="true" view="true" /> 
          <property name="x" type="Number" typeShow="input" disabled="false" impExp="true" view="true" /> 
	      <property name="y" type="Number" typeShow="input" disabled="false" impExp="true" view="true" />
	      <property name="width" type="Number" typeShow="input" disabled="false" impExp="true" view="true" /> 
	      <property name="height" type="Number" typeShow="input" disabled="false" impExp="true" view="true" /> 
	      <property name="label" type="String" typeShow="input" disabled="false" impExp="true" view="true"/> 
      </propertiesNode>
       <featuresNode>
        </featuresNode>
      <nodeStyle autoresize="false" height="30" iconTollbarSVGPath="./image/Activity/ActionIcon.svg" imgSVGPath="./image/Activity/Action.svg" width="60"/>
      <nodeValidation allAnchorsConnect="false" degreeIn="unbounded" degreeOut="unbounded">
        <connects>
          <connect max="unbounded" min="0" to="Component" with="Activation"/>
        </connects>
      </nodeValidation>
    </nodeTypes>
    
    
    <nodeTypes>
      <type>Activity</type>
      <variant>Activity</variant>
      <label alignment="center" defaultValue="Activity" disabled="false" firstLetterCase="lowercase" letterCase="lowercase" pattern="(\w+)" position="center" marginHeight="0" marginWidth="0"  underlined="0"  textColor="black" textFont="11px Arial" >
        <field name="name" value="1"/>
      </label>
      <isConfigurable>true</isConfigurable>
      <includeElement>false</includeElement>
       <rotation>false</rotation>
      <infoUrlNode>
        <url>https://www.tutorialspoint.com/uml/uml_basic_notations.htm</url>
      </infoUrlNode>
       <handlers> 
         <handler  position="northwest"/> 
         <handler  position="northeast"/>
         <handler  position="southeast"/>
         <handler  position="southwest"/> 
      </handlers>
      <anchors> 
         <anchor  position="north"/>
         <anchor  position="south"/> 
          <anchor  position="east"/>
          <anchor  position="west"/> 
      </anchors>
      <propertiesNode>
         <property name="type" type="String" typeShow="input" disabled="true" impExp="true" view="true"  />
	      <property name="id" type="Number" typeShow="input" disabled="true" impExp="true" view="true" /> 
          <property name="x" type="Number" typeShow="input" disabled="false" impExp="true" view="true" /> 
	      <property name="y" type="Number" typeShow="input" disabled="false" impExp="true" view="true" />
	      <property name="width" type="Number" typeShow="input" disabled="false" impExp="true" view="true" /> 
	      <property name="height" type="Number" typeShow="input" disabled="false" impExp="true" view="true" /> 
	      <property name="label" type="String" typeShow="input" disabled="false" impExp="true" view="true"/> 
      </propertiesNode>
       <featuresNode>
        </featuresNode>
      <nodeStyle autoresize="false" height="40" iconTollbarSVGPath="./image/Activity/ActivityIcon.svg" imgSVGPath="./image/Activity/Activity.svg" width="100"/>
      <nodeValidation allAnchorsConnect="false" degreeIn="unbounded" degreeOut="unbounded">
        <connects>
          <connect max="unbounded" min="0" to="Component" with="Activation"/>
        </connects>
      </nodeValidation>
    </nodeTypes>
    
    
    
     <nodeTypes>
      <type>Decision</type>
      <variant>Decision</variant>
      <label alignment="center" defaultValue="" disabled="true" firstLetterCase="lowercase" letterCase="lowercase" pattern="(\w+)" position="center" marginHeight="0" marginWidth="0" underlined="0"  textColor="black" textFont="11px Arial" >
        <field name="name" value="1"/>
      </label>
      <isConfigurable>true</isConfigurable>
      <includeElement>false</includeElement>
       <rotation>false</rotation>
      <infoUrlNode>
        <url>https://www.tutorialspoint.com/uml/uml_basic_notations.htm</url>
      </infoUrlNode>
      <handlers> 
         <handler  position="northwest"/> 
         <handler  position="northeast"/>
         <handler  position="southeast"/>
         <handler  position="southwest"/> 
      </handlers>
      <anchors> 
         <anchor  position="north"/>
         <anchor  position="south"/> 
          <anchor  position="east"/>
          <anchor  position="west"/> 
      </anchors>
      <propertiesNode>
         <property name="type" type="String" typeShow="input" disabled="true" impExp="true" view="true"  />
	      <property name="id" type="Number" typeShow="input" disabled="true" impExp="true" view="true" /> 
          <property name="x" type="Number" typeShow="input" disabled="false" impExp="true" view="true" /> 
	      <property name="y" type="Number" typeShow="input" disabled="false" impExp="true" view="true" />
	      <property name="width" type="Number" typeShow="input" disabled="false" impExp="true" view="true" /> 
	      <property name="height" type="Number" typeShow="input" disabled="false" impExp="true" view="true" /> 
	      <property name="label" type="String" typeShow="input" disabled="false" impExp="true" view="true"/> 
      </propertiesNode>
       <featuresNode>
        </featuresNode>
      <nodeStyle autoresize="false" height="40" iconTollbarSVGPath="./image/Activity/DecisionIcon.svg" imgSVGPath="./image/Activity/Decision.svg" width="40"/>
      <nodeValidation allAnchorsConnect="false" degreeIn="unbounded" degreeOut="unbounded">
        <connects>
          <connect max="unbounded" min="0" to="Component" with="Decision"/>
        </connects>
      </nodeValidation>
    </nodeTypes>
    
     <nodeTypes>
      <type>Initial</type>
      <variant>Initial</variant>
      <label alignment="center" defaultValue="" disabled="true" firstLetterCase="lowercase" letterCase="lowercase" pattern="(\w+)" position="center" marginHeight="0" marginWidth="0" underlined="0"  textColor="black" textFont="11px Arial" >
        <field name="name" value="1"/>
      </label>
      <isConfigurable>true</isConfigurable>
      <includeElement>false</includeElement>
       <rotation>false</rotation>
      <infoUrlNode>
        <url>https://www.tutorialspoint.com/uml/uml_basic_notations.htm</url>
      </infoUrlNode>
       <handlers> 
         <handler  position="northwest"/> 
         <handler  position="northeast"/>
         <handler  position="southeast"/>
         <handler  position="southwest"/> 
      </handlers>
      <anchors> 
         <anchor  position="north"/>
         <anchor  position="south"/> 
          <anchor  position="east"/>
          <anchor  position="west"/> 
      </anchors>
      <propertiesNode>
         <property name="type" type="String" typeShow="input" disabled="true" impExp="true" view="true"  />
	      <property name="id" type="Number" typeShow="input" disabled="true" impExp="true" view="true" /> 
          <property name="x" type="Number" typeShow="input" disabled="false" impExp="true" view="true" /> 
	      <property name="y" type="Number" typeShow="input" disabled="false" impExp="true" view="true" />
	      <property name="width" type="Number" typeShow="input" disabled="false" impExp="true" view="true" /> 
	      <property name="height" type="Number" typeShow="input" disabled="false" impExp="true" view="true" /> 
	      <property name="label" type="String" typeShow="input" disabled="false" impExp="true" view="true"/> 
      </propertiesNode>
       <featuresNode>
        </featuresNode>
      <nodeStyle autoresize="false" height="35" iconTollbarSVGPath="./image/Activity/InitialIcon.svg" imgSVGPath="./image/Activity/Initial.svg" width="35"/>
      <nodeValidation allAnchorsConnect="false" degreeIn="unbounded" degreeOut="unbounded">
        <connects>
          <connect max="unbounded" min="0" to="Component" with="Decision"/>
        </connects>
      </nodeValidation>
    </nodeTypes>
        
  
      <nodeTypes>
      <type>Final</type>
      <variant>Initial</variant>